{
  "schema": "kage.delivery/1",
  "project_id": "prj_evening_train",
  "title": "The Evening Train",
  "version": "1.0.0",
  "created": "2026-10-29T14:48:37",
  "duration_s": 25.583333,
  "frames": 614,
  "fps": {
    "num": 24,
    "den": 1
  },
  "films": [
    {
      "format": "landscape",
      "aspect": "16:9",
      "path": "output/the_evening_train_landscape.mp4",
      "sha256": "ce5158d615e4dee1fb388603d6df8519b56330a5a6254f5978158428cc866692",
      "bytes": 3445996,
      "qa": "qa/landscape/final.json"
    },
    {
      "format": "vertical",
      "aspect": "9:16",
      "path": "output/the_evening_train_vertical.mp4",
      "sha256": "8bb74835d60619caa3e7ccdceb60d25d4321562ec088ef75840b6e0fa29f96de",
      "bytes": 3418398,
      "qa": "qa/vertical/final.json"
    }
  ],
  "supporting_files": [
    {
      "path": "output/stems/ambience.wav",
      "sha256": "0abd4a75a7a8091bc2ed8c65f2a209c868c7962c3d234607cb795ffce8140607"
    },
    {
      "path": "output/stems/dialogue.wav",
      "sha256": "e8acde9d9e704d2b9f0a942c294f8f2c7d155af0bb461abb604f28790e66ca65"
    },
    {
      "path": "output/stems/master.wav",
      "sha256": "2527f0cf0d37e32ae4b05989e7372fb748a8a6f4e8ba6af91735d7f8400be4ad"
    },
    {
      "path": "output/stems/music.wav",
      "sha256": "259be74a181049df746f87220ed6f9b749e37aa05e5e7bc71b47b8b0e3564279"
    },
    {
      "path": "output/stems/sfx.wav",
      "sha256": "d9b27d6f361a615eac2bf9b20122734cb46c369734da74279a5a873e13adbb29"
    },
    {
      "path": "output/the_evening_train.srt",
      "sha256": "026464d4955cd0d9398fb66fb62790edc41c103d188bc8c2e76d32f44f82f858"
    }
  ],
  "shot_exports": [
    "output/shots/landscape/shot_s01_010.mp4",
    "output/shots/landscape/shot_s02_010.mp4",
    "output/shots/landscape/shot_s02_020.mp4",
    "output/shots/landscape/shot_s02_030.mp4",
    "output/shots/landscape/shot_s02_040.mp4",
    "output/shots/vertical/shot_s01_010.mp4",
    "output/shots/vertical/shot_s02_010.mp4",
    "output/shots/vertical/shot_s02_020.mp4",
    "output/shots/vertical/shot_s02_030.mp4",
    "output/shots/vertical/shot_s02_040.mp4"
  ],
  "qa_reports": [
    "qa/audio.json",
    "qa/identity.json",
    "qa/landscape/continuity.json",
    "qa/landscape/final.json",
    "qa/landscape/shot_s01_010.json",
    "qa/landscape/shot_s02_010.json",
    "qa/landscape/shot_s02_020.json",
    "qa/landscape/shot_s02_030.json",
    "qa/landscape/shot_s02_040.json",
    "qa/planning.json",
    "qa/reviews.json",
    "qa/vertical/continuity.json",
    "qa/vertical/final.json",
    "qa/vertical/shot_s01_010.json",
    "qa/vertical/shot_s02_010.json",
    "qa/vertical/shot_s02_020.json",
    "qa/vertical/shot_s02_030.json",
    "qa/vertical/shot_s02_040.json"
  ],
  "subjective_reviews": [
    {
      "stage": "identity",
      "reviewer": "claude-opus-5-5 (image-capable model)",
      "kind": "visual",
      "verdict": "approved",
      "artifacts": [
        "output/review/lineup_final.png",
        "output/review/lineup_silhouette.png"
      ],
      "notes": "Viewed lineup PNGs. Maya/Lila/conductor distinct by height, head ratio, hair, headwear, accessories. Earlier revision failed (Maya's hair invisible, sleeves unreadable) and was fixed in the component library.",
      "at": "2026-10-29T14:36:48"
    },
    {
      "stage": "final:landscape",
      "reviewer": "claude-opus-5-5 (image-capable model)",
      "kind": "visual",
      "verdict": "approved",
      "artifacts": [
        "output/review/contact_landscape.png",
        "output/review/storyboard_landscape.png"
      ],
      "notes": "Viewed contact sheet and full-res frames at 9.0s, 12.5s, 16.0s, 21.5s of the delivered MP4. Earlier revisions failed review (window showed solid hill; feet sank during sit) and were fixed. Lean reads as 'resting against', closer to chest than shoulder.",
      "at": "2026-10-29T14:36:48"
    },
    {
      "stage": "audio",
      "reviewer": "nobody",
      "kind": "listening",
      "verdict": "changes_requested",
      "artifacts": [],
      "notes": "NO LISTENING REVIEW PERFORMED: the authoring agent cannot hear audio. Only objective checks ran (loudness, true peak, ducking, sync, pitch estimates). A human should listen before release.",
      "at": "2026-10-29T14:36:48"
    }
  ],
  "tools": {
    "kage_tools": "1.0.0",
    "engine": "/Users/twishamp/Documents/ai-skill-stickman-flim-production/engine/build/kage_render",
    "cmake": "4.4.5",
    "cxx": "21.0.0",
    "ffmpeg": "9.0.2",
    "ffprobe": "9.0.2"
  },
  "provenance": "Visuals rendered by the Kage C++/OpenGL engine from project data. Dialogue: macOS system voices. SFX, ambience and music: procedurally generated by kage synth (no third-party material)."
}
